{
  "repo": "update-auditor",
  "objective": "Add the portable verify/release pipeline and regression harness, adopt the open-source compliance policy, and harden package provenance (signer data, package states, detail view, ViewModel, edge-to-edge) without changing the security posture.",
  "branch": "claude/sovereign-execution-protocol-r676ri",
  "base_commit": "a8450b4690dac6a7ec24e8e263ad12a46b2e980d",
  "head_commit": "3c681ee605e5641e4e3a8be9a97065a57a6dcf9c",
  "owner_agent": "claude (implementation agent, session 01PrmLBnLLWzJjH8rvT3kHac)",
  "claimed": [
    "Gradle wrapper 8.9 with distributionSha256Sum committed (jar matches Gradle's published checksum)",
    "scripts/verify.sh, release.sh, bootstrap-android-sdk.sh, handoff.py, check_third_party.py; CI calls verify.sh and release.sh",
    "Robolectric + Roborazzi + ATF harness: main and detail goldens at 320/411 dp x font 1.0/2.0 x light/dark, accessibility checks, synthetic-inset test",
    "lint abortOnError with committed baseline (only the missing launcher icon remains)",
    "Open-source compliance policy wired into AGENTS.md, CLAUDE.md and the session-start hook",
    "Signer SHA-256 digests, rotation lineage, multi-signer, platform-signed check; FIRST_PARTY needs name + platform signature or pinned digest, else UNVERIFIED",
    "Package states (updated system app, APEX, removed for user), install-source chain, SDK levels",
    "ViewModel scan (no rescan on rotation), detail view, search, filter chips, edge-to-edge insets, strings to resources, epoch 0 shown as unknown, dataExtractionRules, tools:ignore for QUERY_ALL_PACKAGES",
    "third_party.json and THIRD_PARTY_NOTICES.md cover direct, transitive runtime, test and build components and the Gradle wrapper; verify.sh checks the resolved APK classpath against them"
  ],
  "verified": [
    {
      "check": "test",
      "command": "./gradlew --no-daemon --max-workers=2 test",
      "result": "PASS",
      "commit": "3c681ee605e5641e4e3a8be9a97065a57a6dcf9c"
    },
    {
      "check": "lint",
      "command": "./gradlew --no-daemon --max-workers=2 lintDebug",
      "result": "PASS",
      "commit": "3c681ee605e5641e4e3a8be9a97065a57a6dcf9c"
    },
    {
      "check": "assembleDebug",
      "command": "./gradlew --no-daemon --max-workers=2 assembleDebug",
      "result": "PASS",
      "commit": "3c681ee605e5641e4e3a8be9a97065a57a6dcf9c"
    },
    {
      "check": "third-party",
      "command": "python3 scripts/check_third_party.py",
      "result": "PASS",
      "commit": "3c681ee605e5641e4e3a8be9a97065a57a6dcf9c"
    },
    {
      "check": "runtime-deps",
      "command": "./gradlew --no-daemon --max-workers=2 printRuntimeDependencies; check_third_party.py --resolved",
      "result": "PASS",
      "commit": "3c681ee605e5641e4e3a8be9a97065a57a6dcf9c"
    },
    {
      "check": "handoff-schema",
      "command": "python3 scripts/handoff.py validate",
      "result": "PASS",
      "commit": "3c681ee605e5641e4e3a8be9a97065a57a6dcf9c"
    },
    {
      "check": "diff-check",
      "command": "git diff --check; git show --check HEAD",
      "result": "PASS",
      "commit": "3c681ee605e5641e4e3a8be9a97065a57a6dcf9c"
    }
  ],
  "not_run": [
    "Real-device install and launch (no device or emulator here); the on-device gate in README.md is the owner's",
    "Instrumented (androidTest) tests: none exist and there is no emulator",
    "Behaviour of the R8-minified release APK on a device (it builds, and release.sh --inspect-only passes on a debug-key-signed copy, but nothing was run)",
    "scripts/release.sh end-to-end with a real keystore: agents do not create keys, so only the unsigned refusal path and --inspect-only were exercised",
    "GitHub Actions run of the new build.yml (not triggered from this session)",
    "Real signature data from a device: signing info was exercised through Robolectric's ShadowSigningInfo, not a real PackageManager"
  ],
  "pending": [
    "Owner: pin release signing cert digests (release/signing-cert.sha256 and app/src/main/assets/first_party_pins.txt) after the first signed build; until then every first-party name shows UNVERIFIED",
    "Owner: sideload the debug APK and re-run the README device gate (classification now needs pins)",
    "Owner: decide PR #3 (adds INTERNET) and PR #7 (AGP bump that breaks CI); neither was touched",
    "Optional: launcher icon (the only lint baseline entry)"
  ],
  "artifacts": [
    {
      "path": "app/build/outputs/apk/debug/app-debug.apk (local build output, not committed)",
      "sha256": "22384787caadb0304999f24fc429a14a5caa2feaeb2c48ef94205e72cbca3f62"
    }
  ],
  "next_action": "Owner tests the debug APK on the device, pins the signer digests after the first signed release, then merges the branch if satisfied.",
  "next_executor_hint": "owner-device-test",
  "opened_at": "2026-10-20T23:06:28Z",
  "closed_at": null,
  "owner_interventions": 0
}
